
T:  Bus= 09 Lev= 00 Prnt= 00 Port= 00 Cnt= 00 Dev#=  1 Spd=12  MxCh= 2
V:  Not available for Passthrough
B:  Alloc=  0/900 us ( 0%), #Int=  0, #Iso=  0
D:  Ver= 1.10 Cls=09(hub  ) Sub=00 Prot=00 MxPS=64 #Cfgs=  1
P:  Vendor=0000 ProdID=0000 Rev= 2.06
S:  Manufacturer=vmklinux26  uhci_hcd
S:  Product=UHCI Host Controller
S:  SerialNumber=0000:00:1d.2
C:* #Ifs= 1 Cfg#= 1 Atr=e0 MxPwr=  0mA
I:* If#= 0 Alt= 0 #EPs= 1 Cls=09(hub  ) Sub=00 Prot=00 Driver=hub
E:  Ad=81(I) Atr=03(Int.) MxPS=   2 Ivl=255ms

T:  Bus= 08 Lev= 00 Prnt= 00 Port= 00 Cnt= 00 Dev#=  1 Spd=12  MxCh= 2
V:  Not available for Passthrough
B:  Alloc=  0/900 us ( 0%), #Int=  0, #Iso=  0
D:  Ver= 1.10 Cls=09(hub  ) Sub=00 Prot=00 MxPS=64 #Cfgs=  1
P:  Vendor=0000 ProdID=0000 Rev= 2.06
S:  Manufacturer=vmklinux26  uhci_hcd
S:  Product=UHCI Host Controller
S:  SerialNumber=0000:00:1d.1
C:* #Ifs= 1 Cfg#= 1 Atr=e0 MxPwr=  0mA
I:* If#= 0 Alt= 0 #EPs= 1 Cls=09(hub  ) Sub=00 Prot=00 Driver=hub
E:  Ad=81(I) Atr=03(Int.) MxPS=   2 Ivl=255ms

T:  Bus= 07 Lev= 00 Prnt= 00 Port= 00 Cnt= 00 Dev#=  1 Spd=12  MxCh= 2
V:  Not available for Passthrough
B:  Alloc=  0/900 us ( 0%), #Int=  0, #Iso=  0
D:  Ver= 1.10 Cls=09(hub  ) Sub=00 Prot=00 MxPS=64 #Cfgs=  1
P:  Vendor=0000 ProdID=0000 Rev= 2.06
S:  Manufacturer=vmklinux26  uhci_hcd
S:  Product=UHCI Host Controller
S:  SerialNumber=0000:00:1d.0
C:* #Ifs= 1 Cfg#= 1 Atr=e0 MxPwr=  0mA
I:* If#= 0 Alt= 0 #EPs= 1 Cls=09(hub  ) Sub=00 Prot=00 Driver=hub
E:  Ad=81(I) Atr=03(Int.) MxPS=   2 Ivl=255ms

T:  Bus= 06 Lev= 00 Prnt= 00 Port= 00 Cnt= 00 Dev#=  1 Spd=12  MxCh= 2
V:  Not available for Passthrough
B:  Alloc=  0/900 us ( 0%), #Int=  0, #Iso=  0
D:  Ver= 1.10 Cls=09(hub  ) Sub=00 Prot=00 MxPS=64 #Cfgs=  1
P:  Vendor=0000 ProdID=0000 Rev= 2.06
S:  Manufacturer=vmklinux26  uhci_hcd
S:  Product=UHCI Host Controller
S:  SerialNumber=0000:00:1a.2
C:* #Ifs= 1 Cfg#= 1 Atr=e0 MxPwr=  0mA
I:* If#= 0 Alt= 0 #EPs= 1 Cls=09(hub  ) Sub=00 Prot=00 Driver=hub
E:  Ad=81(I) Atr=03(Int.) MxPS=   2 Ivl=255ms

T:  Bus= 05 Lev= 00 Prnt= 00 Port= 00 Cnt= 00 Dev#=  1 Spd=12  MxCh= 2
V:  Not available for Passthrough
B:  Alloc=  4/900 us ( 0%), #Int=  2, #Iso=  0
D:  Ver= 1.10 Cls=09(hub  ) Sub=00 Prot=00 MxPS=64 #Cfgs=  1
P:  Vendor=0000 ProdID=0000 Rev= 2.06
S:  Manufacturer=vmklinux26  uhci_hcd
S:  Product=UHCI Host Controller
S:  SerialNumber=0000:00:1a.1
C:* #Ifs= 1 Cfg#= 1 Atr=e0 MxPwr=  0mA
I:* If#= 0 Alt= 0 #EPs= 1 Cls=09(hub  ) Sub=00 Prot=00 Driver=hub
E:  Ad=81(I) Atr=03(Int.) MxPS=   2 Ivl=255ms

T:  Bus= 05 Lev= 01 Prnt= 01 Port= 00 Cnt= 01 Dev#=  2 Spd=12  MxCh= 0
V:  Not available for Passthrough
D:  Ver= 1.10 Cls=00(>ifc ) Sub=00 Prot=00 MxPS=64 #Cfgs=  1
P:  Vendor=0557 ProdID=2221 Rev= 0.01
S:  Manufacturer=Winbond Electronics Corp
S:  Product=Hermon USB hidmouse Device
C:* #Ifs= 2 Cfg#= 1 Atr=e0 MxPwr=100mA
I:* If#= 0 Alt= 0 #EPs= 1 Cls=03(HID  ) Sub=01 Prot=02 Driver=usbhid
E:  Ad=82(I) Atr=03(Int.) MxPS=   8 Ivl=10ms
I:* If#= 1 Alt= 0 #EPs= 1 Cls=03(HID  ) Sub=01 Prot=01 Driver=usbhid
E:  Ad=81(I) Atr=03(Int.) MxPS=   8 Ivl=10ms

T:  Bus= 04 Lev= 00 Prnt= 00 Port= 00 Cnt= 00 Dev#=  1 Spd=12  MxCh= 2
V:  Not available for Passthrough
B:  Alloc=  0/900 us ( 0%), #Int=  0, #Iso=  0
D:  Ver= 1.10 Cls=09(hub  ) Sub=00 Prot=00 MxPS=64 #Cfgs=  1
P:  Vendor=0000 ProdID=0000 Rev= 2.06
S:  Manufacturer=vmklinux26  uhci_hcd
S:  Product=UHCI Host Controller
S:  SerialNumber=0000:00:1a.0
C:* #Ifs= 1 Cfg#= 1 Atr=e0 MxPwr=  0mA
I:* If#= 0 Alt= 0 #EPs= 1 Cls=09(hub  ) Sub=00 Prot=00 Driver=hub
E:  Ad=81(I) Atr=03(Int.) MxPS=   2 Ivl=255ms

T:  Bus= 02 Lev= 00 Prnt= 00 Port= 00 Cnt= 00 Dev#=  1 Spd=480 MxCh= 6
V:  Not available for Passthrough
B:  Alloc=  0/800 us ( 0%), #Int=  1, #Iso=  0
D:  Ver= 2.00 Cls=09(hub  ) Sub=00 Prot=01 MxPS=64 #Cfgs=  1
P:  Vendor=0000 ProdID=0000 Rev= 2.06
S:  Manufacturer=vmklinux26  ehci_hcd
S:  Product=EHCI Host Controller
S:  SerialNumber=0000:00:1d.7
C:* #Ifs= 1 Cfg#= 1 Atr=e0 MxPwr=  0mA
I:* If#= 0 Alt= 0 #EPs= 1 Cls=09(hub  ) Sub=00 Prot=00 Driver=hub
E:  Ad=81(I) Atr=03(Int.) MxPS=   4 Ivl=256ms

T:  Bus= 02 Lev= 01 Prnt= 01 Port= 00 Cnt= 01 Dev#= 18 Spd=480 MxCh= 4
V:  Not available for Passthrough
D:  Ver= 2.00 Cls=09(hub  ) Sub=00 Prot=01 MxPS=64 #Cfgs=  1
P:  Vendor=050d ProdID=0416 Rev= 7.02
C:* #Ifs= 1 Cfg#= 1 Atr=e0 MxPwr=100mA
I:* If#= 0 Alt= 0 #EPs= 1 Cls=09(hub  ) Sub=00 Prot=00 Driver=hub
E:  Ad=81(I) Atr=03(Int.) MxPS=   1 Ivl=256ms

T:  Bus= 02 Lev= 02 Prnt=18 Port= 00 Cnt= 01 Dev#= 19 Spd=12  MxCh= 0
V:  Available for Passthrough
D:  Ver= 2.00 Cls=e0(unk. ) Sub=01 Prot=01 MxPS=64 #Cfgs=  1
P:  Vendor=0a12 ProdID=0001 Rev=52.76
C:* #Ifs= 2 Cfg#= 1 Atr=80 MxPwr=200mA
I:* If#= 0 Alt= 0 #EPs= 3 Cls=e0(unk. ) Sub=01 Prot=01 Driver=(none)
E:  Ad=81(I) Atr=03(Int.) MxPS=  16 Ivl=1ms
E:  Ad=02(O) Atr=02(Bulk) MxPS=  64 Ivl=0ms
E:  Ad=82(I) Atr=02(Bulk) MxPS=  64 Ivl=0ms
I:* If#= 1 Alt= 0 #EPs= 2 Cls=e0(unk. ) Sub=01 Prot=01 Driver=(none)
E:  Ad=03(O) Atr=01(Isoc) MxPS=   0 Ivl=1ms
E:  Ad=83(I) Atr=01(Isoc) MxPS=   0 Ivl=1ms
I:  If#= 1 Alt= 1 #EPs= 2 Cls=e0(unk. ) Sub=01 Prot=01 Driver=(none)
E:  Ad=03(O) Atr=01(Isoc) MxPS=   9 Ivl=1ms
E:  Ad=83(I) Atr=01(Isoc) MxPS=   9 Ivl=1ms
I:  If#= 1 Alt= 2 #EPs= 2 Cls=e0(unk. ) Sub=01 Prot=01 Driver=(none)
E:  Ad=03(O) Atr=01(Isoc) MxPS=  17 Ivl=1ms
E:  Ad=83(I) Atr=01(Isoc) MxPS=  17 Ivl=1ms
I:  If#= 1 Alt= 3 #EPs= 2 Cls=e0(unk. ) Sub=01 Prot=01 Driver=(none)
E:  Ad=03(O) Atr=01(Isoc) MxPS=  25 Ivl=1ms
E:  Ad=83(I) Atr=01(Isoc) MxPS=  25 Ivl=1ms
I:  If#= 1 Alt= 4 #EPs= 2 Cls=e0(unk. ) Sub=01 Prot=01 Driver=(none)
E:  Ad=03(O) Atr=01(Isoc) MxPS=  33 Ivl=1ms
E:  Ad=83(I) Atr=01(Isoc) MxPS=  33 Ivl=1ms
I:  If#= 1 Alt= 5 #EPs= 2 Cls=e0(unk. ) Sub=01 Prot=01 Driver=(none)
E:  Ad=03(O) Atr=01(Isoc) MxPS=  49 Ivl=1ms
E:  Ad=83(I) Atr=01(Isoc) MxPS=  49 Ivl=1ms

T:  Bus= 02 Lev= 02 Prnt=18 Port= 01 Cnt= 02 Dev#= 23 Spd=480 MxCh= 0
V:  Available for Passthrough
D:  Ver= 2.00 Cls=00(>ifc ) Sub=00 Prot=00 MxPS=64 #Cfgs=  1
P:  Vendor=0bda ProdID=8187 Rev= 1.00
S:  Manufacturer=Manufacturer_Realtek_RTL8187_
S:  Product=RTL8187_Wireless_LAN_Adapter
S:  SerialNumber=001AEF1B2CB7
C:* #Ifs= 1 Cfg#= 1 Atr=80 MxPwr=500mA
I:* If#= 0 Alt= 0 #EPs= 3 Cls=00(>ifc ) Sub=00 Prot=00 Driver=(none)
E:  Ad=81(I) Atr=02(Bulk) MxPS= 512 Ivl=0ms
E:  Ad=02(O) Atr=02(Bulk) MxPS= 512 Ivl=0ms
E:  Ad=03(O) Atr=02(Bulk) MxPS= 512 Ivl=0ms

T:  Bus= 02 Lev= 02 Prnt=18 Port= 02 Cnt= 03 Dev#= 21 Spd=12  MxCh= 0
V:  Available for Passthrough
D:  Ver= 2.00 Cls=e0(unk. ) Sub=01 Prot=01 MxPS=64 #Cfgs=  1
P:  Vendor=0a12 ProdID=0001 Rev=52.76
C:* #Ifs= 2 Cfg#= 1 Atr=80 MxPwr=200mA
I:* If#= 0 Alt= 0 #EPs= 3 Cls=e0(unk. ) Sub=01 Prot=01 Driver=(none)
E:  Ad=81(I) Atr=03(Int.) MxPS=  16 Ivl=1ms
E:  Ad=02(O) Atr=02(Bulk) MxPS=  64 Ivl=0ms
E:  Ad=82(I) Atr=02(Bulk) MxPS=  64 Ivl=0ms
I:* If#= 1 Alt= 0 #EPs= 2 Cls=e0(unk. ) Sub=01 Prot=01 Driver=(none)
E:  Ad=03(O) Atr=01(Isoc) MxPS=   0 Ivl=1ms
E:  Ad=83(I) Atr=01(Isoc) MxPS=   0 Ivl=1ms
I:  If#= 1 Alt= 1 #EPs= 2 Cls=e0(unk. ) Sub=01 Prot=01 Driver=(none)
E:  Ad=03(O) Atr=01(Isoc) MxPS=   9 Ivl=1ms
E:  Ad=83(I) Atr=01(Isoc) MxPS=   9 Ivl=1ms
I:  If#= 1 Alt= 2 #EPs= 2 Cls=e0(unk. ) Sub=01 Prot=01 Driver=(none)
E:  Ad=03(O) Atr=01(Isoc) MxPS=  17 Ivl=1ms
E:  Ad=83(I) Atr=01(Isoc) MxPS=  17 Ivl=1ms
I:  If#= 1 Alt= 3 #EPs= 2 Cls=e0(unk. ) Sub=01 Prot=01 Driver=(none)
E:  Ad=03(O) Atr=01(Isoc) MxPS=  25 Ivl=1ms
E:  Ad=83(I) Atr=01(Isoc) MxPS=  25 Ivl=1ms
I:  If#= 1 Alt= 4 #EPs= 2 Cls=e0(unk. ) Sub=01 Prot=01 Driver=(none)
E:  Ad=03(O) Atr=01(Isoc) MxPS=  33 Ivl=1ms
E:  Ad=83(I) Atr=01(Isoc) MxPS=  33 Ivl=1ms
I:  If#= 1 Alt= 5 #EPs= 2 Cls=e0(unk. ) Sub=01 Prot=01 Driver=(none)
E:  Ad=03(O) Atr=01(Isoc) MxPS=  49 Ivl=1ms
E:  Ad=83(I) Atr=01(Isoc) MxPS=  49 Ivl=1ms

T:  Bus= 02 Lev= 02 Prnt=18 Port= 03 Cnt= 04 Dev#= 22 Spd=480 MxCh= 0
V:  Available for Passthrough
D:  Ver= 2.00 Cls=ff(vend.) Sub=ff Prot=ff MxPS=64 #Cfgs=  1
P:  Vendor=fffe ProdID=0002 Rev= 0.04
C:* #Ifs= 1 Cfg#= 1 Atr=80 MxPwr=100mA
I:* If#= 0 Alt= 0 #EPs= 0 Cls=ff(vend.) Sub=ff Prot=ff Driver=(none)
I:  If#= 0 Alt= 1 #EPs= 6 Cls=ff(vend.) Sub=ff Prot=ff Driver=(none)
E:  Ad=01(O) Atr=02(Bulk) MxPS= 512 Ivl=0ms
E:  Ad=81(I) Atr=02(Bulk) MxPS= 512 Ivl=0ms
E:  Ad=02(O) Atr=02(Bulk) MxPS= 512 Ivl=0ms
E:  Ad=04(O) Atr=02(Bulk) MxPS= 512 Ivl=0ms
E:  Ad=86(I) Atr=02(Bulk) MxPS= 512 Ivl=0ms
E:  Ad=88(I) Atr=02(Bulk) MxPS= 512 Ivl=0ms
I:  If#= 0 Alt= 2 #EPs= 6 Cls=ff(vend.) Sub=ff Prot=ff Driver=(none)
E:  Ad=01(O) Atr=03(Int.) MxPS=  64 Ivl=125us
E:  Ad=81(I) Atr=03(Int.) MxPS=  64 Ivl=125us
E:  Ad=02(O) Atr=03(Int.) MxPS= 512 Ivl=125us
E:  Ad=04(O) Atr=02(Bulk) MxPS= 512 Ivl=0ms
E:  Ad=86(I) Atr=03(Int.) MxPS= 512 Ivl=125us
E:  Ad=88(I) Atr=02(Bulk) MxPS= 512 Ivl=0ms
I:  If#= 0 Alt= 3 #EPs= 6 Cls=ff(vend.) Sub=ff Prot=ff Driver=(none)
E:  Ad=01(O) Atr=03(Int.) MxPS=  64 Ivl=125us
E:  Ad=81(I) Atr=03(Int.) MxPS=  64 Ivl=125us
E:  Ad=02(O) Atr=01(Isoc) MxPS= 512 Ivl=125us
E:  Ad=04(O) Atr=02(Bulk) MxPS= 512 Ivl=0ms
E:  Ad=86(I) Atr=01(Isoc) MxPS= 512 Ivl=125us
E:  Ad=88(I) Atr=02(Bulk) MxPS= 512 Ivl=0ms

T:  Bus= 02 Lev= 01 Prnt= 01 Port= 02 Cnt= 02 Dev#=  3 Spd=480 MxCh= 0
V:  Available for Passthrough, currently in use
D:  Ver= 2.00 Cls=00(>ifc ) Sub=00 Prot=00 MxPS=64 #Cfgs=  1
P:  Vendor=0bda ProdID=8187 Rev= 1.00
S:  Manufacturer=Manufacturer_Realtek_RTL8187_
S:  Product=RTL8187_Wireless_LAN_Adapter
S:  SerialNumber=001AEF1B290E
C:* #Ifs= 1 Cfg#= 1 Atr=80 MxPwr=500mA
I:* If#= 0 Alt= 0 #EPs= 3 Cls=00(>ifc ) Sub=00 Prot=00 Driver=usbfs
E:  Ad=81(I) Atr=02(Bulk) MxPS= 512 Ivl=0ms
E:  Ad=02(O) Atr=02(Bulk) MxPS= 512 Ivl=0ms
E:  Ad=03(O) Atr=02(Bulk) MxPS= 512 Ivl=0ms

T:  Bus= 02 Lev= 01 Prnt= 01 Port= 03 Cnt= 03 Dev#=  4 Spd=480 MxCh= 0
V:  Available for Passthrough
D:  Ver= 2.00 Cls=00(>ifc ) Sub=00 Prot=00 MxPS=64 #Cfgs=  1
P:  Vendor=0bda ProdID=8187 Rev= 1.00
S:  Manufacturer=Manufacturer_Realtek_RTL8187_
S:  Product=RTL8187_Wireless_LAN_Adapter
S:  SerialNumber=001AEF1B2921
C:* #Ifs= 1 Cfg#= 1 Atr=80 MxPwr=500mA
I:* If#= 0 Alt= 0 #EPs= 3 Cls=00(>ifc ) Sub=00 Prot=00 Driver=(none)
E:  Ad=81(I) Atr=02(Bulk) MxPS= 512 Ivl=0ms
E:  Ad=02(O) Atr=02(Bulk) MxPS= 512 Ivl=0ms
E:  Ad=03(O) Atr=02(Bulk) MxPS= 512 Ivl=0ms

T:  Bus= 02 Lev= 01 Prnt= 01 Port= 04 Cnt= 04 Dev#= 12 Spd=480 MxCh= 0
V:  Available for Passthrough
D:  Ver= 2.00 Cls=00(>ifc ) Sub=00 Prot=00 MxPS=64 #Cfgs=  1
P:  Vendor=0bda ProdID=8187 Rev= 1.00
S:  Manufacturer=Manufacturer_Realtek_RTL8187_
S:  Product=RTL8187_Wireless_LAN_Adapter
S:  SerialNumber=001AEF1B2C2F
C:* #Ifs= 1 Cfg#= 1 Atr=80 MxPwr=500mA
I:* If#= 0 Alt= 0 #EPs= 3 Cls=00(>ifc ) Sub=00 Prot=00 Driver=(none)
E:  Ad=81(I) Atr=02(Bulk) MxPS= 512 Ivl=0ms
E:  Ad=02(O) Atr=02(Bulk) MxPS= 512 Ivl=0ms
E:  Ad=03(O) Atr=02(Bulk) MxPS= 512 Ivl=0ms

T:  Bus= 02 Lev= 01 Prnt= 01 Port= 05 Cnt= 05 Dev#= 24 Spd=480 MxCh= 0
V:  Available for Passthrough
D:  Ver= 2.00 Cls=00(>ifc ) Sub=00 Prot=00 MxPS=64 #Cfgs=  1
P:  Vendor=0bda ProdID=8187 Rev= 1.00
S:  Manufacturer=Manufacturer_Realtek_RTL8187_
S:  Product=RTL8187_Wireless_LAN_Adapter
S:  SerialNumber=001AEF1B2CAF
C:* #Ifs= 1 Cfg#= 1 Atr=80 MxPwr=500mA
I:* If#= 0 Alt= 0 #EPs= 3 Cls=00(>ifc ) Sub=00 Prot=00 Driver=(none)
E:  Ad=81(I) Atr=02(Bulk) MxPS= 512 Ivl=0ms
E:  Ad=02(O) Atr=02(Bulk) MxPS= 512 Ivl=0ms
E:  Ad=03(O) Atr=02(Bulk) MxPS= 512 Ivl=0ms

T:  Bus= 01 Lev= 00 Prnt= 00 Port= 00 Cnt= 00 Dev#=  1 Spd=480 MxCh= 6
V:  Not available for Passthrough
B:  Alloc=  0/800 us ( 0%), #Int=  0, #Iso=  0
D:  Ver= 2.00 Cls=09(hub  ) Sub=00 Prot=01 MxPS=64 #Cfgs=  1
P:  Vendor=0000 ProdID=0000 Rev= 2.06
S:  Manufacturer=vmklinux26  ehci_hcd
S:  Product=EHCI Host Controller
S:  SerialNumber=0000:00:1a.7
C:* #Ifs= 1 Cfg#= 1 Atr=e0 MxPwr=  0mA
I:* If#= 0 Alt= 0 #EPs= 1 Cls=09(hub  ) Sub=00 Prot=00 Driver=hub
E:  Ad=81(I) Atr=03(Int.) MxPS=   4 Ivl=256ms

T:  Bus= 01 Lev= 01 Prnt= 01 Port= 00 Cnt= 01 Dev#=  4 Spd=480 MxCh= 0
V:  Available for Passthrough, currently in use
D:  Ver= 2.00 Cls=00(>ifc ) Sub=00 Prot=00 MxPS=64 #Cfgs=  1
P:  Vendor=1058 ProdID=1003 Rev= 1.75
S:  Manufacturer=Western Digital 
S:  Product=External HDD    
S:  SerialNumber=57442D574341553434363333313333
C:* #Ifs= 1 Cfg#= 1 Atr=c0 MxPwr=  2mA
I:* If#= 0 Alt= 0 #EPs= 2 Cls=08(stor.) Sub=06 Prot=50 Driver=usbfs
E:  Ad=81(I) Atr=02(Bulk) MxPS= 512 Ivl=0ms
E:  Ad=02(O) Atr=02(Bulk) MxPS= 512 Ivl=0ms
